fund_url,fund_name,applicant_types,geographic_scope,beneficiary_focus,funding_range,restrictions,application_status,deadline,notes,eligibility,evidence,pages_scraped,visited_urls_count,extraction_timestamp,error,source_folder
https://quartetcf.org.uk,www.quartetcf.org.uk,Registered charities; Community/voluntary groups; Community Interest Companies (CICs); Town/Parish Councils; Community Benefit Societies,"West of England (Bristol, Bath and North East Somerset, North Somerset, South Gloucestershire)","Disadvantaged communities; People in need of support; Vulnerable people; People facing inequality, hardship, or disadvantage","Up to £25,000 (most grants); some funds up to £50,000 - £99,999; majority of grants awarded to organisations with income under £500,000","Applicants must be based and working in the West of England (Bristol, Bath and North East Somerset, North Somerset, South Gloucestershire); Will not fund medical research, equipment or treatment; Will not fund activities/statutory services that are the responsibility of government/public bodies; Will not fund sports or arts projects with no community/charitable element; Will not fund animal welfare, political, or religious activities intended to influence beliefs",rolling,"None stated (rolling programmes, but individual funds may have deadlines)","National charities can apply only if they have a base and significant local presence in the West of England and the grant will benefit local people. Most funding is directed to small, local organisations. Organisations with significant reserves may be deprioritised. Ellenor Hospice is based in Kent and serves Kent/London boroughs, not the West of England.",Not Eligible,"Quartet Community Foundation's funding is strictly for organisations 'based and working in the West of England (Bristol, Bath and North East Somerset, North Somerset, South Gloucestershire)'. Ellenor Hospice is based in Gravesend, Kent, and serves Dartford, Gravesham, Swanley, and Bexley, which are not within the West of England. The eligibility page states: 'We often prioritise small, local organisations whose work benefits people living in the West of England. However, national charities with a base in the area and a significant local presence can apply if the grant will benefit local people.' Ellenor Hospice does not have a base or service provision in the West of England. Therefore, it is not eligible for Quartet Community Foundation funding.",15,15,15/10/2025 12:49,,www.quartetcf.org.uk
https://www.raynefoundation.org.uk,www.raynefoundation.org.uk,UK-based voluntary organisations; statutory organisations; not-for-profit organisations; registered charities,UK (including England and Kent),children and young people (especially care-experienced or with mental health needs); people in later life and their carers,"Not explicitly stated for UK grants; typical grants are project and salary costs for 1-3 years, with an approximate total annual grants budget of just over £2 million. For Israel, £10,000-£20,000 pa is mentioned, but not for UK.","Work must directly benefit one or more of the three priority groups: children and young people, refugees and asylum seekers, people in later life and their carers; No funding for day-to-day running costs of local organisations or buildings; No capital, equipment or vehicle appeals; No medical research; No exclusively campaigning/lobbying work; No retrospective funding; No endowments; No individual use; No organisations working or based outside the UK; No applications from organisations rejected in the past 12 months; No funding for business-as-usual services or activities with only local impact",rolling,None (open rolling programme),"Proposed work must be innovative, have potential for wider application, and demonstrate match-funding. For core costs, annual grant size should not exceed 10% of annual income. High unrestricted reserves (>9 months) may reduce eligibility. Must show impact beyond local level and share learning. Priority is for projects, not ongoing core service delivery.",Possibly Eligible,"ellenor Hospice is a UK-registered charity based in Kent, serving children, young people, adults, and families with palliative and end-of-life care. The Rayne Foundation funds UK-based voluntary/not-for-profit organisations, including charities, and its geographic scope includes Kent. However, funding is strictly for innovative projects that benefit one of three priority groups: children and young people (especially care-experienced or with mental health needs), refugees/asylum seekers, or people in later life and their carers. ellenor’s work with children, young people, and people in later life could fit, but only if the project is innovative, has potential for wider application, and is not simply continuation of core services. The Foundation does not fund day-to-day running costs or business-as-usual local services, which is a significant restriction for hospices. There is no explicit exclusion of hospices, but the focus on innovation and wider impact, plus the requirement for match-funding and limits on core cost grants, means eligibility depends on the specific project proposed. No deadline; applications are rolling. Overall, ellenor Hospice is 'Possibly Eligible' if it can propose an innovative project aligned with the Foundation’s priority groups and criteria.",14,14,15/10/2025 12:49,,www.raynefoundation.org.uk
https://www.richmondfoundation.org.uk,www.richmondfoundation.org.uk,Registered charities; Community Interest Companies; Schools; Other properly constituted not for profit organisations,"London Borough of Richmond upon Thames (postcodes: TW9, TW10, SW13, SW14)",Disadvantaged children and young people; Low-income adults; People experiencing health inequalities; Vulnerable and isolated residents; Community groups in Richmond,"Not explicitly stated; example Core grant: £56,100 (2023/24); total commitment: £1m over 5 years","Applications that do not support people living in TW9, TW10, SW13, SW14; Organisations not registered charities, CICs, schools, or not-for-profits; Medical research, animal welfare, political projects; Major capital appeals; Activities promoting religion or belief; Improvements to buildings mainly used for worship; Retrospective funding; General charitable appeals; Anything that is the primary responsibility of a statutory body",open,13 August 2025; 29 October 2025; 28 January 2026; 24 April 2026,Applicants must support people living in the specified Richmond postcodes. Organisations with high reserves are unlikely to be funded. New applicants are encouraged to contact the grants team before applying. Grants committee meets quarterly.,Not Eligible,"ellenor Hospice is a registered UK charity providing palliative and end-of-life care, which matches the applicant type and beneficiary focus. However, the Richmond Foundation's funding is strictly limited to organisations and beneficiaries living or working in the London Borough of Richmond upon Thames, specifically postcodes TW9, TW10, SW13, and SW14. ellenor Hospice is based in Gravesend, Kent, and serves Dartford, Gravesham, Swanley, and Bexley, which are outside the Richmond Foundation's geographic scope. The guidelines explicitly state: 'Applications that do not support people living in our benefit area postcodes: TW9, TW10, SW13, and SW14' are not funded. Therefore, ellenor Hospice is not eligible to apply.",14,14,15/10/2025 12:49,,www.richmondfoundation.org.uk
https://rothschildfoundation.org.uk,www.rothschildfoundation.org.uk,Not-for-profit organisations; Registered charities; Charities registered with the Charity Commission or Companies House; Formally constituted groups,"Buckinghamshire (as defined by Buckinghamshire Council, excludes Milton Keynes); some strategic grants in London/UK but not open to unsolicited applications",Disadvantaged communities in Buckinghamshire; People experiencing homelessness; People facing financial hardship; People with physical and learning disabilities; People with mental health and wellbeing needs,"Community Fund: up to £30,000 over 3 years (max £10,000/year); Strategic Fund: up to £300,000 over 3 years","Must benefit people living in Buckinghamshire; Organisations with income over £1 million not eligible for Community Fund; No funding for projects outside Buckinghamshire (for open programmes); No funding for medical care or medical equipment; No funding for for-profit organisations, individuals, animal welfare, promotion of religion, overseas travel, uniformed groups, or reimbursement for past activity; Organisations must have at least three Directors or Trustees",open,"27th January, 18th April, 27th August, 18th November (for grants under £30,000); 31st March, 1st September (for grants over £30,000)",Applicants must demonstrate a strong track record or partnerships in Buckinghamshire. Grants are only for activity benefiting Buckinghamshire residents. Strategic Fund and Community Fund are not open to unsolicited applications from outside Buckinghamshire. Grants for London/UK projects are by invitation only.,Not Eligible,"1. The Rothschild Foundation's open grant programmes (Community Fund and Strategic Fund) are explicitly for not-for-profit organisations providing services in Buckinghamshire. The guidelines state: 'We don’t fund in Milton Keynes or counties neighbouring Buckinghamshire.' and 'Projects that benefit people living outside the county of Buckinghamshire' are excluded. 2. The Foundation's FAQs clarify: 'Our grants programme awarding grants in London and across the UK is not open to unsolicited applications.' 3. ellenor Hospice is based in Kent and serves Dartford, Gravesham, Swanley, and Bexley, not Buckinghamshire. 4. There is no evidence of an open route for Kent-based hospices to apply, and the Foundation does not fund medical care or medical equipment. 5. Therefore, ellenor Hospice is not eligible for any of the Rothschild Foundation's open funding streams.",15,15,15/10/2025 12:50,,www.rothschildfoundation.org.uk
https://www.samworthfoundation.org.uk,www.samworthfoundation.org.uk,charities; not-for-profit organisations; organisations working in the UK or internationally,"UK (including Kent), international",survivors of modern slavery; people at risk of exploitation; environmental causes; nature and climate positive farming,"£86,000 - £300,000 (recent grants); no formal minimum or maximum stated",No open application process; funding is by invitation only; Focus is on modern slavery/exploitation and environment/climate change; Does not respond to unsolicited funding requests,closed,,The Foundation does not operate an open fund. Organisations cannot apply directly; funding is by invitation following proactive identification by the Foundation. Main funding themes are Modern Slavery & Exploitation and Environment & Climate Change. Hospices and palliative care are not mentioned as a focus.,Not Eligible,"1. The Samworth Foundation explicitly states: 'We don’t operate an open fund so please don’t spend valuable time writing to us for funding because we are unable to respond to requests.' (FAQs, Grantmaking, Homepage). 2. Funding is by invitation only, with no open application process. 3. The Foundation's two main funding themes are Modern Slavery & Exploitation and Environment & Climate Change; there is no mention of palliative care, hospices, or end-of-life care as a focus. 4. While the Foundation funds UK-wide and supports charities, the lack of an open application route and the absence of relevant beneficiary focus means ellenor Hospice cannot apply or be considered under current criteria. 5. Therefore, ellenor Hospice is Not Eligible.",15,15,15/10/2025 12:50,,www.samworthfoundation.org.uk
https://sfct.org.uk,www.sfct.org.uk,charities; nonprofits; community organisations,UK (individual trusts may have more specific focus areas),"varies by trust; includes environment, social inclusion, education, arts, heritage, health (some trusts); some trusts support children, young people, disadvantaged groups",Not stated; varies by trust and project,"Most trusts do not have an open application process; applications are generally by invitation or proactive approach by trustees; Some trusts have very specific focus areas (e.g., environment, arts, refugee support, leukaemia research); Some trusts explicitly do not fund outside their focus areas or do not fund individuals",closed (for most trusts); some have open/defined processes for specific areas,Not applicable (no open application process for most trusts),ellenor Hospice would need to identify a trust with a relevant health or palliative care focus and be proactively approached or invited to apply. The majority of Sainsbury Family Charitable Trusts do not accept unsolicited applications. The True Colours Trust (not detailed here) is known to support palliative care but application details are not provided in this text.,Low Match,"The Sainsbury Family Charitable Trusts (SFCT) is an umbrella for 16 independent trusts, each with its own focus and application process. The majority of trusts do not have an open application process and instead invite applications or proactively seek out grantees ('Applications for funding are generally invited by the Trustees or initiated at their request'). Most trusts have specific focus areas (e.g., environment, arts, refugee support, leukaemia research) that do not align with hospice or palliative care, and several explicitly state they are unlikely to fund outside these areas. There is no evidence that hospices or palliative care are a current focus for any of the trusts listed in the provided text, and no open application route is available. The only possible exception is The True Colours Trust, which is known externally to support palliative care, but no application details or open process are provided in the supplied information. Therefore, ellenor Hospice is a low match for funding from SFCT trusts based on the information available.",14,14,15/10/2025 12:50,,www.sfct.org.uk
https://www.sharegift.org,www.sharegift.org,UK registered charities,UK,Any charitable purpose (cause-neutral),Unspecified; grants based on value of shares donated and number of suggestions received,No formal application process; donations are made based on donor and partner suggestions and internal research; Subject to due diligence,rolling,,"ShareGift does not accept applications; charities can be suggested by donors or corporate partners. All UK registered charities are eligible, subject to due diligence. Cause-neutral and has supported over 3,500 charities.",Highly Eligible,"1. ShareGift states: 'We can give to any UK registered charity, subject to due diligence, and are giving to new charities almost every month.' 2. Geographic scope is UK-wide, which includes Kent. 3. There are no restrictions excluding hospices or healthcare charities; ShareGift is cause-neutral. 4. Funding is not fixed but grants have been made to thousands of charities, including those in health and palliative care. 5. The process is rolling, with donations made regularly based on suggestions. 6. The only limitation is that there is no formal application process; eligibility is determined by being a UK registered charity and being suggested by donors or partners. Overall, ellenor Hospice is highly eligible and should encourage supporters to suggest them to ShareGift.",8,8,15/10/2025 12:51,,www.sharegift.org
https://www.shearsfoundation.org,www.shearsfoundation.org,"Registered charities (excluding hospices, except for a core group in Newcastle)","Tyne & Wear, Northumberland, Harrogate, York, Bradford, Greater Manchester (North of England core areas only)",Health and medicine (research or education); Culture and arts; Education; Environment; Community development,"£3,000 - £6,000","Hospices not eligible (except for a core group in Newcastle); Organisations with income above £1.5M not eligible (from March 2024, except core groups); Applications only accepted from organisations working in Tyne & Wear, Northumberland, Harrogate, York, Bradford, Greater Manchester; No capital projects (buildings, major repairs, vehicles, large equipment, etc.)",open,"Quarterly deadlines: 31 May, 31 August, 30 November, 28/29 February",Applicants must have a phone or Zoom call with the Foundation before applying. Applications from outside the specified geographic areas are not accepted due to high demand in core areas.,Not Eligible,"The Shears Foundation explicitly states: 'We currently don't consider applications from Hospices because we make a major annual contribution to a hospice in Newcastle.' Additionally, applications are only accepted from organisations working in Tyne & Wear, Northumberland, Harrogate, York, Bradford, and Greater Manchester. ellenor Hospice is located in Kent and is a hospice, so it is doubly excluded: both by applicant type (hospices not eligible) and by geography (Kent is not within the eligible regions). The income restriction (£1.5M max) would also exclude ellenor Hospice (£8.2M income), but the explicit hospice and geographic exclusions are sufficient for a 'Not Eligible' determination.",13,13,15/10/2025 12:51,,www.shearsfoundation.org
,www.sobellfoundation.org.uk,,,,,,unclear,,No funding information or eligibility criteria available due to inaccessible content.,Possibly Eligible,"The page content is inaccessible ('This page uses frames, but your browser doesn't support them'), so no explicit eligibility criteria, applicant types, geographic scope, or restrictions can be confirmed. It is possible that the Sobell Foundation funds hospices or health charities, but without further information, only a 'Possibly Eligible' rating can be given. Recommend visiting the foundation's website directly or contacting them for detailed eligibility criteria.",1,1,15/10/2025 12:51,,www.sobellfoundation.org.uk
,www.sussexgiving.org.uk,charities; community groups,Sussex,health; poverty; community; environment; social isolation,not stated,,unclear,not stated,"Funding is for projects, services, and core costs that help charities and community groups in Sussex. Geographic focus is strictly on Sussex.",Not Eligible,"The Sussex Community Foundation funds charities and community groups specifically to benefit communities within Sussex. ellenor Hospice is based in Kent and serves Dartford, Gravesham, Swanley, and Bexley, which are not within Sussex. There is no indication that grants are available for organizations outside Sussex. The eligibility criteria and funding priorities are focused on making a 'lasting local difference' in Sussex, and the Foundation emphasizes its knowledge and support of Sussex communities. Therefore, ellenor Hospice does not meet the geographic eligibility requirement.",1,1,15/10/2025 12:51,,www.sussexgiving.org.uk
https://www.synconaltd.com,www.synconaltd.com_the-foundation,"UK registered charities; charities focused on health; charities focused on disease prevention, treatment, or care",UK,"patients with cancer; patients with other diseases; people needing treatment, prevention, or cure of disease; general healthcare beneficiaries",Not stated,"No explicit exclusions found; focus is on health, disease, and related charitable activities",unclear,Not stated,"Funding is provided via The Syncona Foundation, which supports UK health and disease-related charities. No open application process or deadlines are specified. The Foundation's objectives include prevention, treatment, cure, and eradication of cancer and other diseases, as well as other charitable activities.",Eligible,"1. The Syncona Foundation's charitable objectives include 'the prevention, treatment, cure and ultimately eradication of cancer and other diseases, as well as other charitable activities.' 2. Syncona provides annual philanthropic funding to the Foundation, which supports UK health and disease-related charities. 3. Geographic scope is UK-wide, which includes Kent. 4. Beneficiary focus includes patients with life-limiting conditions and those needing treatment or care, matching ellenor Hospice's services. 5. No explicit restrictions excluding hospices or palliative care charities are stated. 6. However, there is no public information about an open application process, funding range, or deadlines, so status is 'unclear.' 7. Overall, ellenor Hospice is a strong thematic match for the Foundation's objectives, but the lack of a clear application route or process prevents a 'Highly Eligible' rating.",15,15,15/10/2025 12:51,,www.synconaltd.com_the-foundation
https://talbotvillagetrust.org,www.talbotvillagetrust.org,Registered Charities; Charitable Incorporated Organisations (CIO); Constituted community/voluntary organisations and associations; Faith organisations (for community benefit); State schools (with restrictions); Industrial and Provident Societies; Community Interest Companies (CIC) Limited by Guarantee; Social Enterprises limited by guarantee (with not-for-profit clause and charitable/social objectives),"Bournemouth, Christchurch, Poole, Purbeck, East Dorset (South East Dorset)","People and communities in South East Dorset; Older people; People experiencing loneliness or isolation; People with mental health needs; People facing disadvantage (including disability, poverty, inequality); Children and young people; Marginalised groups; Bereaved children and families","Small Grants: up to £5,000 (annual turnover under £250,000); Capital Grants: £10,000+ (no upper limit stated, but recent grants up to £40,000)","Organisation must be located, have a base, or deliver services within Bournemouth, Christchurch, Poole, Purbeck, or East Dorset; Small Grants: annual turnover under £250,000; Capital Grants: must show capital expenditure is planned and integrated into strategy, 25% match funding required; No funding for facilities outside area of benefit; No retrospective funding; No funding for research or research infrastructure (including medical research); No funding for vehicles (except by exception); No funding for projects that duplicate existing services or where statutory funding has been withdrawn; No funding for animal welfare (except assistance therapy); No funding for one-off events with limited long-term benefit; No funding for individuals (except by invitation)",closed,"31 August 2025 (for next round, but currently closed)","Applicants must demonstrate benefit to people within the area of benefit (South East Dorset). Ellenor Hospice is based in Kent and serves Dartford, Gravesham, Swanley, and Bexley, which are outside the Trust's area of benefit. Previous grants have supported hospices and palliative care within Dorset, but not outside the defined area.",Not Eligible,"1. The Trust's area of benefit is strictly defined as Bournemouth, Christchurch, Poole, Purbeck, and East Dorset. Ellenor Hospice is based in Kent and serves areas outside this geographic scope. 2. The eligibility policy states: 'Your organisation must: either be located or have a base within our area of benefit, or deliver service within it (Bournemouth, Christchurch, Poole, Purbeck, or East Dorset).' 3. While the Trust funds registered charities and has previously supported palliative care and hospice services (e.g., Julia’s House in Dorset), all funded organisations are based in or deliver services within the specified Dorset area. 4. There is no indication that projects or services delivered solely in Kent would be eligible, and the restrictions explicitly state 'No funding for facilities outside of the Area of Benefit even where these may be used by persons residing within the Area.' 5. Therefore, Ellenor Hospice does not meet the core geographic eligibility requirement and is not eligible to apply.",15,15,15/10/2025 12:51,,www.talbotvillagetrust.org
https://www.tallowchandlers.org,www.tallowchandlers.org_education-charity_charities-grants,charities; educational establishments; youth organisations; schools; universities,"Primarily London, with some support for City-based and London-area organisations; focus on London but not explicitly excluding other UK regions",young people; disadvantaged youth; students; STEM education; education and skills development,Not stated,"Priority is young, disadvantaged people through education and skills, primarily in London; Focus on STEM and education; No explicit mention of hospice or healthcare funding; No evidence of support for palliative care or end-of-life services",rolling,Not stated; appeals considered quarterly,"Applicants must align with the objective of supporting young people through education and skills, especially in London. Appeals are reviewed quarterly. No explicit exclusion of hospices, but no evidence of support for healthcare or palliative care charities.",Low Match,"1. The Tallow Chandlers' Benevolent Fund prioritises 'supporting young, disadvantaged people through education and skills, primarily in London.' 2. The geographic focus is London, with no explicit inclusion of Kent or the South East, and no evidence of grants to organisations outside London. 3. The beneficiary focus is on education, STEM, and youth development, not healthcare or palliative care. 4. No explicit exclusion of hospices, but no evidence of support for health or palliative care charities. 5. ellenor Hospice's core activities (palliative and end-of-life care) do not align with the Fund's stated priorities. 6. Funding is available on a rolling basis, but the match to ellenor Hospice's mission is minimal. Recommendation: ellenor Hospice is a low match for this fund due to the educational and London-centric focus.",6,6,15/10/2025 12:52,,www.tallowchandlers.org_education-charity_charities-grants
