fund_url,fund_name,applicant_types,geographic_scope,beneficiary_focus,funding_range,restrictions,application_status,deadline,notes,eligibility,evidence,pages_scraped,visited_urls_count,extraction_timestamp,error,source_folder
https://newsroom.bathnes.gov.uk,www.bathnes.gov.uk_node_88648,regional charities; national charities; UK registered charities,UK-wide,children; young people; parents; caregivers affected by Adverse Childhood Experiences (ACEs); mental health; trauma recovery,"up to £25,000 over 12 months (occasionally up to 3 years)","Key focus must be on preventing/reducing the impact of Adverse Childhood Experiences (ACEs); Must use trauma-informed, evidence-based interventions; Must be actively patient-led; Must demonstrate real impact through evaluation or research; Annual income must be under £20 million; At least 5 years’ audited or independently examined accounts required",open,05/11/2025,Applicants must pass an eligibility checker and submit an Expression of Interest before being invited to full application. Focus is on charities solely supporting children/young people or parents affected by ACEs.,Possibly Eligible,"ellenor Hospice is a UK registered charity with an annual income under £20 million and over 5 years of accounts, meeting the basic organisational criteria. However, the James Tudor Foundation Mental Health Grants Programme requires that applicants have a key focus on preventing/reducing the impact of Adverse Childhood Experiences (ACEs) and use trauma-informed, evidence-based interventions, with services being actively patient-led. ellenor Hospice provides palliative and end-of-life care, including bereavement support and therapies for children and families, which may overlap with trauma support, but its primary mission is not solely focused on ACEs or trauma prevention. The fund is open and the funding range is suitable. However, unless ellenor can demonstrate that a specific project or service is dedicated to trauma-informed, ACE-focused work (e.g., bereavement support for children affected by ACEs), eligibility is not certain. Therefore, eligibility is rated as 'Possibly Eligible'—a strong case could be made if a relevant, trauma-informed project is proposed, but the core hospice mission is not a direct match for the fund's primary focus.",15,15,15/10/2025 12:30,,www.bathnes.gov.uk_node_88648
https://newsroom.bathnes.gov.uk,www.bathnes.gov.uk_node_90422,regional charities; national charities; UK registered charities,UK-wide,children; young people; parents; caregivers affected by Adverse Childhood Experiences (ACEs); families,"up to £25,000 over 12 months (occasionally up to 3 years)","Key focus must be on preventing and/or reducing the impact of Adverse Childhood Experiences (ACEs); Must use trauma-informed, evidence-based interventions; Must be actively patient-led; Must demonstrate real impact through evaluation or research; Annual income must be under £20 million; At least 5 years’ audited or independently examined accounts required",open,05/11/2025,Applicants must pass an eligibility checker and submit an Expression of Interest before being invited to full application. Focus is on charities solely supporting children/young people or parents affected by ACEs.,Possibly Eligible,"ellenor Hospice is a UK registered charity with an annual income of £8.2M (under the £20M cap) and over 5 years of operation. The James Tudor Foundation Mental Health Grants Programme is open to regional and national charities across the UK, with a focus on children, young people, and parents affected by Adverse Childhood Experiences (ACEs). ellenor provides palliative and end-of-life care, including bereavement support and therapies for children and families, which may overlap with trauma-informed support. However, the fund requires that the applicant's key focus is on preventing/reducing the impact of ACEs and that they are 'solely' focused on supporting these groups through evidence-based, trauma-informed interventions. While ellenor supports children and families, its primary mission is palliative care, not exclusively ACEs or trauma. Therefore, eligibility is possible if ellenor can demonstrate a dedicated, trauma-informed programme for children/parents affected by ACEs, but it is not a direct or highly targeted match. Application is open until 5 November 2025, and no restrictions explicitly exclude hospices. Next step: Review whether ellenor's services can be framed as trauma-informed ACEs interventions and use the eligibility checker.",15,15,15/10/2025 12:30,,www.bathnes.gov.uk_node_90422
https://www.bbc.co.uk,www.bbc.co.uk_pudsey,,,,,,not found,,No funding opportunity or grant information is present in the provided text.,Not Eligible,"The provided page text contains no information about any funding opportunity, grant, or eligibility criteria. There are no references to applicant types, geographic scope, funding amounts, restrictions, or application processes. Therefore, ellenor Hospice cannot be assessed for eligibility as no relevant funding scheme is described.",14,14,15/10/2025 12:31,,www.bbc.co.uk_pudsey
https://www.belron.com,www.belron.com_doing-business-responsibly_serving-society_belron-ronny-lubner-charitable-foundation,charities; non-profit organisations; social enterprises; community organisations,"International (UK, Germany, South Africa, Uganda, global)",children; young people; refugees; asylum seekers; girls at risk of child marriage; communities affected by conflict; early years education,Not stated,"Focus on young people, children, refugees, and education; No explicit mention of hospice or palliative care support; No open application process described",unclear,Not stated,"Current grantees focus on youth, education, refugees, and vulnerable children. No evidence of funding for health, hospice, or palliative care organisations. No public application process described.",Low Match,"The Belron Ronnie Lubner Charitable Foundation supports a range of international charities, primarily focused on children, young people, refugees, and education (e.g., Girls Not Brides, Young Roots, SmartStart). There is no mention of hospices, palliative care, or health sector charities among current grantees. The Foundation's statement highlights 'making a real difference to young people.' No open or rolling application process is described, and there is no evidence that health or hospice charities are considered. Geographic scope is broad and includes the UK, but the beneficiary focus and lack of relevant grantees make ellenor Hospice a low match.",4,4,15/10/2025 12:31,,www.belron.com_doing-business-responsibly_serving-society_belron-ronny-lubner-charitable-foundation
https://www.berkeleyfoundation.org.uk,www.berkeleyfoundation.org.uk,Registered charities; Expert frontline charities; Charities in health and wellbeing; Charities supporting young people and communities,"UK (England, including Kent and South East)",Young people; Families; Communities; Health and wellbeing; Vulnerable people,Not stated (varies by grant; long-term partnerships and other grants awarded annually),"No explicit exclusions for hospices or healthcare charities found; Must align with one or more of the Foundation's impact goals (e.g., Health and Wellbeing, A Resilient Voluntary Sector)",unclear,Not stated,The Foundation builds long-term partnerships with expert charities and also makes other grants each year. Grant-making data is published via 360Giving. Charities must align with impact goals such as Health and Wellbeing. No explicit exclusion of hospices or palliative care charities. Safeguarding and partnership requirements apply.,Highly Eligible,"1. Applicant type: The Foundation supports 'registered charities', 'expert frontline charities', and those working in 'health and wellbeing', which matches ellenor Hospice's profile as a registered UK hospice charity. 2. Geographic scope: The Foundation is UK-based and does not exclude Kent or the South East; its partners include charities from across England. 3. Beneficiary focus: Impact goals include 'Health and Wellbeing', 'A Resilient Voluntary Sector', and support for 'young people, families, and communities', all of which align with ellenor's services (palliative care for children, adults, families). 4. Funding range: While specific amounts are not stated, the Foundation makes both long-term partnership grants and other annual grants, indicating flexibility and potential for significant support. 5. Restrictions: No explicit exclusions for hospices or healthcare charities; eligibility is based on alignment with impact goals. 6. Application status: Not explicitly open, but the Foundation makes 'a number of other grants each year' and publishes grant data, suggesting ongoing or periodic opportunities. 7. Overall, ellenor Hospice is a strong match for the Foundation's priorities and funding practices. Next steps: ellenor should review the Foundation's impact goals and consider making contact to discuss partnership or grant opportunities.",15,15,15/10/2025 12:31,,www.berkeleyfoundation.org.uk
https://bishopradfordtrust.org.uk,www.bishopradfordtrust.org.uk,UK registered charities; churches with Christian ministry in their charitable objectives,UK and internationally,Christian ministry; prison sector; church engagement; areas of high deprivation,"up to £2,000 (Foundation Grants); £20,000 per year (Partnership Grants, by invitation only)",Applications currently closed; Non-UK registered charities not eligible; Charities without a Christian ethos and Christian ministry in their objectives not eligible; Building/capital projects excluded; Pilot schemes excluded unless previously funded or known to Trustees; Charities must have filed at least one set of accounts; Preference for small charities (under £1M income) for partnership grants,closed,"Unclear; Foundation Grants close once allocation is filled, dates for reopening published on homepage","Applicants must pass an eligibility quiz. Foundation Grants are one-off and rarely exceed £2,000. Partnership grants are by invitation and for small charities under £1M income. Priority given to projects in areas of high deprivation and to charities with a Christian ethos/ministry.",Not Eligible,"1. Applications are currently closed: 'Applications are now closed.' 2. Only UK registered charities or churches with Christian ministry in their objectives are eligible; ellenor Hospice does not have an explicit Christian ministry focus. 3. Foundation Grants are capped at £2,000 and are one-off; partnership grants are by invitation and for small charities (ellenor's income is £8.2M, well above the preferred threshold). 4. Restrictions explicitly exclude charities without a Christian ethos/ministry. 5. No indication that hospices or palliative care (unless explicitly Christian ministry) are a focus. 6. Therefore, ellenor Hospice is not eligible for this funding round.",14,14,15/10/2025 12:32,,www.bishopradfordtrust.org.uk
https://www.bramallfoundation.org,www.bramallfoundation.org,registered charities; charitable organisations,UK (emphasis on Yorkshire region),public health; public amenities; people in need; people experiencing sickness; people with financial hardship; children; elderly; disabled; general public,Not stated,Emphasis on Yorkshire region; No explicit exclusions for hospices or healthcare charities,rolling,None stated (applications considered quarterly at trustee meetings),Applications must be submitted by letter or email with a 120-word summary and project details. No accounts required. Trustees meet quarterly.,Eligible,"1. Registered charities are eligible to apply; hospices are not excluded. 2. The Foundation's objects include 'the relief of sickness and the advancement of health' and 'the provision of public health facilities', which aligns with ellenor Hospice's palliative care work. 3. Geographic scope is UK-wide but with an emphasis on Yorkshire; ellenor Hospice is in Kent, so not in the priority region but not excluded. 4. No funding range is specified, but the application process is open and rolling, with quarterly trustee meetings. 5. No explicit restrictions against hospices or healthcare charities. Overall, ellenor Hospice is eligible to apply, but may be a lower priority due to the Yorkshire emphasis.",2,2,15/10/2025 12:32,,www.bramallfoundation.org
https://buttleuk.org,www.buttleuk.org,"Frontline professionals working for a registered charity, housing association, or public sector organisation (applying on behalf of individual children/young people)",UK-wide,"Children and young people (aged 2-18 living with parent/carer, or up to 20 if living independently) who have experienced a crisis with significant impact on wellbeing and education","Up to £2,400 per child/young person","Applications must be made by frontline professionals, not directly by organisations for general funding; Funding is for individual children/young people, not for organisational or service-wide projects; Child/young person must have experienced a qualifying crisis (e.g., abuse, bereavement, family member in end-of-life care, etc.); Child/young person must be in education/training for at least 12 hours per week; Cannot fund where main issue is poverty, poor housing, homelessness, disability, ongoing chronic illness, or family separation; Looked After Children are not eligible",rolling,,"ellenor Hospice staff may apply as frontline professionals for individual children/young people they support, provided all criteria are met. Grants are not for general hospice funding or service delivery.",Possibly Eligible,"Buttle UK grants are only available for individual children/young people who have experienced a qualifying crisis, with applications submitted by frontline professionals from registered charities. ellenor Hospice, as a registered charity providing palliative and end-of-life care (including to children and families), could have eligible staff who meet the 'frontline professional' criteria. However, the funding is not for organisational or service-wide use, but for specific children/young people meeting strict crisis and education criteria (e.g., bereavement, family member in end-of-life care). The geographic scope is UK-wide and includes Kent. The funding amount is suitable for individual support, but not for core hospice costs. Restrictions exclude general organisational funding and focus on direct support to children/young people. Therefore, ellenor Hospice is 'Possibly Eligible' only in the context of staff applying for individual children/young people, not for general hospice funding.",15,15,15/10/2025 12:32,,www.buttleuk.org
https://www.cambscf.org.uk,www.cambscf.org.uk,"Registered charities; Charitable incorporated organisations (CIOs); Religious organisations (if project benefits wider community and is non-religious in content); Parish and town councils; Village halls; Parochial church councils; Community interest companies (CICs); Social Enterprises; Companies Limited by Guarantee; Co-operatives; Community benefit societies; Schools; Community amateur sports clubs (CASCs) with income under £5,000 or affiliated with a national governing body",Cambridgeshire (very small number of funds may accept applications from outside Cambridgeshire),Health and wellbeing; Vulnerable people; People experiencing inequality or disadvantage; General community benefit,"Minimum £1,500 (organisation grants); average £4,500; each fund specifies its own range",Projects must be delivered within Cambridgeshire (except a very small number of funds); Cannot fund activities/projects already completed; Cannot fund fundraising activities; Cannot usually fund grant-making bodies; Cannot fund improvements to land/buildings not open to the public; Cannot fund political activities or lobbying; Cannot fund projects promoting religion; Cannot fund animal welfare projects; Cannot fund overseas travel; Cannot fund statutory obligations or activities replacing government funding,seasonal,"Quarterly: 1 February, 1 May, 1 August, 1 November (11:59am)","Most funds require projects to be delivered in Cambridgeshire. Only a very small number of funds accept applications from outside Cambridgeshire. Applicants must be not-for-profit and legally registered if income is above £5,000. Applications are via general or fund-specific forms. Funding is competitive and not all eligible projects are funded.",Not Eligible,"ellenor Hospice is a registered UK charity providing palliative and end-of-life care, which matches the applicant type and beneficiary focus. However, the Cambridgeshire Community Foundation's grants are for projects delivered within Cambridgeshire, and ellenor Hospice is based in Gravesend, Kent, serving Dartford, Gravesham, Swanley, and Bexley. The guidance states: 'We support projects delivered within Cambridgeshire by national organisations, as long as the funding is restricted to this area of benefit. A very small number of our funds accept applications from outside Cambridgeshire.' There is no evidence that ellenor Hospice delivers services in Cambridgeshire or could restrict funding to that area. Therefore, ellenor Hospice is not eligible for the vast majority of funds, and eligibility for the 'very small number' of funds accepting out-of-area applications is not substantiated. Geographic scope is the key exclusion.",14,14,15/10/2025 12:33,,www.cambscf.org.uk
https://www.camdengiving.org.uk,www.camdengiving.org.uk,small charities; social enterprises,"Camden, London",adults aged 30-66; people with disabilities; young people from the global majority; people with disabilities; global majority communities; people experiencing inequality in Camden,"£30,000 (over two years)","Organisations must be Camden-based; Primary focus must be on one or more of: Joy and Integration (adults 30-66 and/or people with disabilities), Employment Support (young people from the global majority and/or people with disabilities), or Mental Health Support (global majority communities and/or people with disabilities); Leadership should be representative of the community served; Current grantees with live Equality Fund grants or overdue reporting are not eligible",open,Monday 3rd November 2026 at 4:30,The fund is only for Camden-based organisations. The panel prioritises organisations led by people with lived experience of the inequalities addressed. Applications must align with the specific focus areas listed.,Not Eligible,"ellenor Hospice is based in Gravesend, Kent, and serves Dartford, Gravesham, Swanley, and Bexley, not Camden. The Equality Fund is explicitly for 'Camden based small charities and social enterprises' and all focus areas and grantee examples are for work within Camden. There is no indication that organisations outside Camden are eligible. Therefore, ellenor Hospice does not meet the geographic eligibility requirement and is not eligible to apply.",15,15,15/10/2025 12:33,,www.camdengiving.org.uk
https://www.caretechfoundation.org.uk,www.caretechfoundation.org.uk,credible and high-quality charities; social enterprises,UK and overseas (including Kent),people living with disabilities; communities in the care sector; UK social care sector; carers; those living in care; vulnerable people,Not explicitly stated; described as 'significant partnerships' and 'medium- to long-term investments',Programmes must satisfy one primary priority area; Current round deadline has passed; not currently accepting new applications; Must align with one of the Foundation’s three key focus areas,closed,The submission deadline for the current round has passed,"Future rounds are anticipated; interested applicants are encouraged to contact the Foundation for updates. Applications must align with the Foundation’s three key focus areas: innovation in care sector, skills development, and improving quality of life for people with disabilities.",Not Eligible,"ellenor Hospice is a registered UK charity providing palliative and end-of-life care, which aligns with the Foundation’s focus on care sector and vulnerable people. The Partnership Grants are open to 'credible and high-quality charities' and have a UK-wide scope, including Kent. However, the current application round is closed: 'The submission deadline for the current round has passed. We hope to be accepting new partnerships in the future and encourage all interested applicants to contact us.' As applications are not currently being accepted and no reopening date is provided, ellenor Hospice is not eligible at this time. If the fund reopens, ellenor Hospice would likely be Highly Eligible based on alignment with focus areas and applicant type.",15,15,15/10/2025 12:33,,www.caretechfoundation.org.uk
https://www.cfct.org.uk,www.cfct.org.uk,registered charity; CIC; social enterprise; other properly constituted not-for-profit organisation with a management committee of at least three unrelated members,Kent and Medway (Greater London boroughs not eligible),vulnerable people; disadvantaged people; families; children; young people; people at the margins of society; bereaved people; people with life-limiting conditions; people needing emotional wellbeing support,"£500 - £10,000 (one-off grant, normally not more than 50% of most recent turnover/income)","Organisations with gross income over £500,000 in the last financial year (some flexibility if slightly higher, but must contact Trust); Free reserves must be less than twelve months of expenditure; Must have at least two years of financial accounts; No funding for hospitals, health authorities, medical care, medical equipment or medical research; No funding for work outside Kent or Medway; No funding for national charities without a physical base in Kent or Medway; No funding for statutory bodies, academic research, animal charities, promotion of religion, heritage projects, annual/one-off events, endowment appeals, or retrospective funding",rolling,none (applications accepted at any time),"ellenor Hospice is a registered charity based in Kent and serves local communities, but its annual income (£8.2M) is well above the £500,000 threshold for the Community Fund. The Trust may offer some flexibility if income is 'slightly higher', but ellenor's income is far in excess of this. The Trust does not fund hospitals, health authorities, or medical care, but does fund local charities supporting vulnerable people, including those affected by bereavement and life-limiting conditions.",Not Eligible,"The Colyer-Fergusson Charitable Trust Community Fund is open to registered charities based in Kent, serving local communities, and supporting vulnerable people, which matches ellenor Hospice's profile. However, the explicit eligibility criteria state: 'Gross income in the last financial year must be £500,000 or less. If your income is slightly higher than this, please contact us as we may be able to offer some flexibility.' ellenor Hospice's annual income is £8.2M, which is more than 16 times the stated maximum and cannot reasonably be considered 'slightly higher.' There is no indication of a separate funding stream for larger charities, and the restrictions are clear. Therefore, ellenor Hospice is Not Eligible for the Community Fund. The Trust's other grant streams (Proactive, Thematic, Partner) are either invitation-only or not open for direct application.",15,15,15/10/2025 12:33,,www.cfct.org.uk
https://www.cfsurrey.org.uk,www.cfsurrey.org.uk,charities; community groups; voluntary groups; VCSE sector organisations,"Surrey (county of Surrey, England)",local communities in Surrey; people in greatest need in Surrey; young people (mental health); vulnerable people; community benefit,"Small grants up to £2,500 (Area Funds); Heritage for All Fund up to £10,000; Main Grants unspecified",Applicants must benefit Surrey communities; Public sector and private companies not eligible; Main Grants and most programmes currently closed until late 2025; Some funds only for individuals; Crisis funding requires sustainability plan,closed,Main Grants and most programmes reopen for EOIs on 17th November 2025; specific deadlines for rounds in 2025-2026,"Applications are only accepted from organisations whose work directly benefits Surrey. ellenor Hospice is based in Kent and serves Dartford, Gravesham, Swanley, and Bexley, which are outside Surrey. No evidence that cross-border projects are eligible. Some small Area Funds may be available, but only if the project benefits a Surrey location.",Not Eligible,"1. The Community Foundation for Surrey explicitly states it supports 'local charities, and community and voluntary groups in Surrey whose work benefits our communities.' 2. All grant descriptions and eligibility criteria focus on benefit to Surrey residents and communities. 3. ellenor Hospice is based in Kent and serves areas outside Surrey (Dartford, Gravesham, Swanley, Bexley). 4. There is no indication that projects outside Surrey or serving non-Surrey beneficiaries are eligible. 5. Application rounds for main grants and most funds are currently closed until November 2025. 6. Even if open, ellenor Hospice's core service area does not match the required geographic focus. 7. Therefore, ellenor Hospice is not eligible for funding from the Community Foundation for Surrey.",15,15,15/10/2025 12:34,,www.cfsurrey.org.uk
